{"record_type":"evidence_registry","records":[{"authority":"source_explicit","claim":"Every selected item is explicitly assigned an unassigned material and manufacturing-process context until evidence-gated annotation is promoted.","confidence":"high","evidence_id":"benchmark.production.assignments","field_path":"/items","limitations":["This record does not claim source-authored material, process, tolerance, or finish intent."],"promotion_check":{"check_id":"deterministic-production-bootstrap-v1","method":"versioned deterministic catalog generation from frozen selection","notes":"The code snapshot and environment bundle bind the exact generator version.","result":"promoted"},"retrieved_at":"2026-07-18T00:00:00Z","scorer_allowed":true,"source_hash":"1afd69b0d256f8c8f5da1c4b2bcdf288f0b84333d87da06cc287161a59e3073a","source_type":"source_file","source_uri_or_path":"src/cadengbench/production/catalog.py#build_bootstrap_catalog","status":"promoted"},{"authority":"source_explicit","claim":"The CADEngBench-P production bootstrap requires each accepted part to remain one valid connected solid.","confidence":"high","evidence_id":"benchmark.production.bootstrap","field_path":"/single_connected_body_required","limitations":["This is a benchmark-authored invariant, not a claim about the source designer's intent."],"promotion_check":{"check_id":"deterministic-production-bootstrap-v1","method":"versioned deterministic catalog generation from frozen selection","notes":"The code snapshot and environment bundle bind the exact generator version.","result":"promoted"},"retrieved_at":"2026-07-18T00:00:00Z","scorer_allowed":true,"source_hash":"1afd69b0d256f8c8f5da1c4b2bcdf288f0b84333d87da06cc287161a59e3073a","source_type":"source_file","source_uri_or_path":"src/cadengbench/production/catalog.py#build_bootstrap_catalog","status":"promoted"}],"registry_id":"p_fusion360_001165:evidence-registry:v2","schema_version":"cadengbench-p.evidence.v2"}
